"Question","Réponse","Expertise","Sous - expertise","Like","Created Date","Updated Date","Owner","Title","ID","Created Date","Updated Date","Owner"
"Quelles sont les étapes de la procédure d'indemnisation après un accident de la route ?","Après un accident de la route, la procédure d'indemnisation suit cinq étapes clés, encadrées par la loi Badinter du 5 juillet 1985 : déclaration à l'assureur, provision, expertise médicale, offre définitive, puis paiement.

1. Déclaration de l'accident — vous devez la transmettre à votre assureur dans les 5 jours ouvrés, de préférence avec un constat amiable signé.

2. Indemnisation provisionnelle — l'assureur du responsable doit vous proposer une provision dans les 8 mois suivant l'accident.

3. Expertise médicale — un médecin expert évalue vos préjudices corporels et fixe la date de consolidation (stabilisation de l'état de santé).

4. Offre d'indemnisation définitive — l'assureur dispose de 5 mois à compter de la consolidation pour formuler son offre.

5. Paiement — le règlement intervient dans les 30 jours suivant votre acceptation.

En cas d'offre insuffisante ou de refus, un avocat peut contester l'évaluation des préjudices et saisir le tribunal.","[""Accidents de la route""]","[""Procédure d'indemnisation""]",1,2025-01-16T13:37:37Z,2025-06-25T12:24:52Z,"d05c9ea4-b2fb-43e7-9de4-52fe8577e54b",,"80c23e9a-6605-4b13-b6bf-bf49955592b3",2026-04-29T09:36:23Z,2026-04-29T09:36:23Z,"d05c9ea4-b2fb-43e7-9de4-52fe8577e54b"
"Comment se déroule une expertise médicale après un accident ?","Lors d'une expertise médicale, un médecin expert — désigné par l'assureur ou le tribunal — examine votre état de santé pour évaluer l'étendue de vos préjudices. Il s'appuie sur votre dossier médical et des barèmes médico-légaux pour chiffrer vos séquelles.

L'expert fixe notamment votre taux de déficit fonctionnel permanent (DFP) et, si votre état le permet, une date de consolidation à partir de laquelle vos préjudices sont considérés comme stabilisés. Son rapport servira de base au calcul de votre indemnisation.

Vous avez le droit d'être assisté lors de l'expertise par un médecin conseil de votre choix — et par un avocat. Cette assistance est fortement recommandée : un médecin expert mandaté par l'assureur défend les intérêts de son mandant, pas les vôtres.","[""Accidents et erreurs médicales"",""Accidents de la route"",""Accidents de la vie courante""]","[""Préjudice""]",1,2025-02-08T22:23:08Z,2025-06-25T12:24:52Z,"d05c9ea4-b2fb-43e7-9de4-52fe8577e54b",,"811c1884-d391-403c-ae9f-5519fb7647d9",2026-04-29T09:36:23Z,2026-04-29T09:36:23Z,"d05c9ea4-b2fb-43e7-9de4-52fe8577e54b"
"Quels soutiens complémentaires à lʼhébergement sont proposés aux victimes de violences conjugales ?","En dehors de lʼhébergement dʼurgence, plusieurs dispositifs permettent une prise en charge globale des victimes de violences conjugales : soutien psychologique, accompagnement social, aide juridique, soutien financier et écoute téléphonique.

Soutien psychologique : des psychologues et psychiatres spécialisés en traumatologie vous accompagnent pour surmonter le choc et reconstruire votre estime de soi.

Accompagnement social : une assistante sociale vous aide dans vos démarches administratives — accès aux aides de la CAF, recherche de logement, droits sociaux.

Aide juridique : un avocat peut obtenir une ordonnance de protection, engager une procédure pénale et vous représenter à chaque étape judiciaire.

Soutien financier : lʼaide universelle dʼurgence pour les victimes de violences conjugales (loi du 28 février 2023) offre un secours financier immédiat, sous forme de prêt ou de don selon la situation.

Ligne dʼécoute : le 3919 (gratuit, 24h/24) oriente vers les structures adaptées près de chez vous.","[""Violences conjugales et féminicides""]","[""Mise à l'abri""]",1,2025-02-10T09:40:50Z,2025-06-25T12:24:52Z,"d05c9ea4-b2fb-43e7-9de4-52fe8577e54b",,"8121372e-97fe-49ea-a4a0-e001fc7fe06b",2026-04-29T09:36:23Z,2026-04-29T09:36:23Z,"d05c9ea4-b2fb-43e7-9de4-52fe8577e54b"
"Quelles actions juridiques mon avocat peut-il engager contre mon assureur ?","Face à un assureur qui refuse d'indemniser ou manque à ses obligations, un avocat spécialisé en droit des assurances dispose de plusieurs leviers : action en responsabilité contractuelle pour obtenir des dommages-intérêts, procédure en référé pour une décision d'urgence (provision, exécution immédiate), ou exécution forcée si l'assureur reste inerte après condamnation.

Il peut également demander la résiliation judiciaire du contrat en cas de clause abusive ou de manquement grave, ou contester une déchéance de garantie en exigeant la preuve d'une fausse déclaration intentionnelle (article L. 113-8 du Code des assurances).

Avant toute procédure contentieuse, une négociation transactionnelle est souvent tentée pour maximiser l'indemnisation sans procès. Le délai de prescription est en principe de deux ans à compter du fait générateur (article L. 114-1 du Code des assurances) — un délai à ne pas laisser expirer.","[""Droit des assurances particuliers et professionnels""]","[""Contentieux et litiges""]",1,2025-02-10T14:54:28Z,2025-06-25T12:24:52Z,"d05c9ea4-b2fb-43e7-9de4-52fe8577e54b",,"830c26d6-37c9-4501-8d8a-f64fbb3c11a5",2026-04-29T09:36:23Z,2026-04-29T09:36:23Z,"d05c9ea4-b2fb-43e7-9de4-52fe8577e54b"
"Que faire si la compagnie d’assurance refuse de m’indemniser ?","Face au refus d'indemnisation d'une compagnie d'assurance, plusieurs recours existent : contestation amiable auprès du service réclamations de l'assureur, puis saisine du médiateur de l'assurance dans un délai d'un an à compter du refus. Si la médiation échoue, le tribunal judiciaire reste compétent.

Avant toute démarche, vérifiez les motifs précis du refus (clause d'exclusion, délai de déclaration non respecté, faute inexcusable…). Certains refus reposent sur des arguments contestables, notamment en matière de garantie conducteur ou de tiers responsable.

En cas d'accident impliquant un tiers non assuré ou non identifié, le Fonds de Garantie des Assurances Obligatoires (FGAO) peut prendre le relais. Un avocat spécialisé peut utilement analyser le refus et engager la procédure adaptée.","[""Accidents de la route""]","[""Divers""]",10,2025-01-16T13:50:31Z,2025-08-04T18:42:47Z,"d05c9ea4-b2fb-43e7-9de4-52fe8577e54b",,"833df282-cbf5-49a6-b74a-2ad0b72959d5",2026-04-29T09:36:23Z,2026-04-29T09:36:23Z,"d05c9ea4-b2fb-43e7-9de4-52fe8577e54b"
"Comment un avocat peut-il aider une victime dʼaccident sportif ?","Un avocat spécialisé aide la victime dʼaccident sportif à identifier le régime de responsabilité applicable — civil, contractuel ou pénal — et à obtenir une indemnisation complète de ses dommages corporels. Il analyse les circonstances de lʼaccident, détermine les responsables (organisateur, pratiquant, club) et les assureurs concernés.

Concrètement, lʼavocat négocie avec lʼassureur du groupement sportif, de lʼorganisateur ou au titre de la garantie accidents de la vie (GAV), et défend les intérêts de la victime lors de lʼexpertise médicale amiable pour éviter une sous-évaluation du préjudice.

Si aucun accord nʼest trouvé, il engage la procédure judiciaire adaptée — tribunal judiciaire ou correctionnel selon les cas — pour obtenir une réparation intégrale des préjudices subis.","[""Accidents de la vie courante""]","[""Accident sportif""]",1,2025-02-10T16:38:52Z,2025-06-25T12:24:52Z,"d05c9ea4-b2fb-43e7-9de4-52fe8577e54b",,"851af36a-ecd5-42ff-8a6d-a4ca3b869258",2026-04-29T09:36:23Z,2026-04-29T09:36:23Z,"d05c9ea4-b2fb-43e7-9de4-52fe8577e54b"
"Pourquoi le DFP est-il déterminant pour calculer votre indemnisation ?","Le déficit fonctionnel permanent (DFP) est le critère central du calcul indemnitaire après un dommage corporel : exprimé en pourcentage (de 1 % à 100 %), il mesure les séquelles définitives conservées après consolidation et conditionne directement le montant alloué par le juge ou l'assureur.

Plus le taux de DFP est élevé, plus l'indemnisation est importante. Ce taux est fixé par un médecin expert selon le barème indicatif publié par le Concours Médical. Il sert de base aux référentiels indemnitaires utilisés par les juridictions civiles, la CIVI ou les fonds de garantie comme le FGTI.

Un avocat spécialisé peut contester un taux sous-évalué en demandant une contre-expertise ou une expertise judiciaire, ce qui peut significativement faire évoluer le montant final de l'indemnisation.","[""Accidents et erreurs médicales"",""Accidents de la route"",""Accidents de la vie courante""]","[""DFP""]",7,2025-02-08T22:16:13Z,2025-07-31T13:54:41Z,"d05c9ea4-b2fb-43e7-9de4-52fe8577e54b",,"85287ac4-3558-46ae-a8fe-deaf8b1ee57f",2026-04-29T09:36:23Z,2026-04-29T09:36:23Z,"d05c9ea4-b2fb-43e7-9de4-52fe8577e54b"
"Qu’est-ce qu’un témoin assisté ?","Le témoin assisté est un statut intermédiaire en matière pénale, accordé à une personne mise en cause lors d'une instruction mais contre laquelle il n'existe pas d'indices graves et concordants justifiant une mise en examen. Il se distingue donc du simple témoin et du mis en examen.

Ce statut ouvre des droits concrets : accès au dossier de l'instruction, droit d'être assisté par un avocat, possibilité de demander des actes d'investigation ou une confrontation avec les personnes qui le mettent en cause (articles 113-1 à 113-8 du Code de procédure pénale).

Le juge d'instruction peut d'office conférer ce statut ou le faire à la demande du procureur ou de la personne concernée. Si les charges s'alourdissent, le témoin assisté peut être mis en examen.","[""Droit Pénal""]","[""Statuts""]",1,2025-01-21T11:32:40Z,2025-06-25T12:24:52Z,"d05c9ea4-b2fb-43e7-9de4-52fe8577e54b",,"85297617-35d4-492d-b690-be13cb8ff813",2026-04-29T09:36:23Z,2026-04-29T09:36:23Z,"d05c9ea4-b2fb-43e7-9de4-52fe8577e54b"
"Comment est accompagnée la victime dans son parcours d’indemnisation ?","L'accompagnement d'une victime grand blessé couvre l'ensemble du parcours d'indemnisation, de la constitution du dossier jusqu'au jugement ou à l'accord amiable. L'objectif est d'obtenir la réparation intégrale de tous les postes de préjudice, y compris les besoins futurs.

Concrètement, cela comprend : la constitution du dossier avec des experts médicaux spécialisés (neurologues, ergothérapeutes, médecins-conseils) ; la négociation d'une provision rapide pour couvrir les premiers frais ; l'encadrement de l'expertise médicale amiable ou judiciaire pour que chaque poste soit correctement évalué ; enfin, la négociation ou l'action en justice pour obtenir une indemnisation intégrale incluant l'aide humaine, la rééducation, les équipements adaptés et la perte de revenus.","[""Accidents de la route""]","[""Grands blessés""]",1,2025-07-23T19:56:22Z,2025-07-23T19:59:13Z,"d05c9ea4-b2fb-43e7-9de4-52fe8577e54b",,"85d08584-c1e2-41d8-a025-421e534252da",2026-04-29T09:36:23Z,2026-04-29T09:36:23Z,"d05c9ea4-b2fb-43e7-9de4-52fe8577e54b"
"Pourquoi faire appel à un avocat pénaliste pour une affaire de trafic de stupéfiants ?","Une affaire de trafic de stupéfiants expose à des peines très lourdes : jusqu'à 10 ans d'emprisonnement et 7 500 000 € d'amende pour trafic simple, davantage en cas de bande organisée (art. 222-37 et 222-34 du Code pénal). Seul un avocat pénaliste maîtrisant ces procédures peut construire une défense adaptée dès la garde à vue.

Concrètement, il contrôle la régularité des actes d'enquête (perquisitions, écoutes, infiltrations), identifie les nullités de procédure exploitables, et prépare une stratégie de défense cohérente face au parquet et au tribunal correctionnel ou à la cour d'assises selon les faits reprochés.

Intervenir tôt — dès la garde à vue — est déterminant : les premières déclarations engagent souvent la suite de la procédure.","[""Trafic de stupéfiants""]","[""Définition du trafic""]",2,2025-02-17T14:27:06Z,2025-06-25T12:24:52Z,"d05c9ea4-b2fb-43e7-9de4-52fe8577e54b",,"85d30068-85ed-418a-810b-25f7cbd6c9c4",2026-04-29T09:36:23Z,2026-04-29T11:41:47Z,"d05c9ea4-b2fb-43e7-9de4-52fe8577e54b"
"Quelles sont les deux formes de détention à domicile sous surveillance électronique ?","La détention à domicile sous surveillance électronique (DDSE) existe sous deux formes : comme peine autonome ou comme aménagement de peine.

En tant que peine autonome, la DDSE se substitue à une peine d'emprisonnement. Elle est prononcée directement par le tribunal et ne peut excéder la durée de la peine initialement encourue. Elle s'applique aux peines comprises entre 15 jours et 6 mois.

En tant qu'aménagement de peine, la DDSE modifie les modalités d'exécution d'une peine de prison ferme déjà prononcée. Elle peut concerner des peines plus longues, jusqu'à 2 ans d'emprisonnement.","[""Droit Pénal""]","[""Détention à domicile""]",1,2025-01-21T11:57:45Z,2025-06-25T12:24:52Z,"d05c9ea4-b2fb-43e7-9de4-52fe8577e54b",,"85f94b71-37b2-4a96-b6ff-21ff2190a49d",2026-04-29T09:36:23Z,2026-04-29T09:36:23Z,"d05c9ea4-b2fb-43e7-9de4-52fe8577e54b"
"Quels sont les éléments constitutifs d’un vice caché ?","Un vice caché est un défaut non apparent qui affecte un bien vendu, empêche son usage normal et aurait conduit l'acheteur à ne pas acheter ou à payer moins cher s'il en avait eu connaissance. Il est encadré par les articles 1641 et suivants du Code civil.

Trois conditions doivent être réunies :
— un défaut inhérent rendant le bien impropre à son usage ou diminuant fortement cet usage ;
— un vice non apparent : un examen normalement attentif au moment de la vente n'aurait pas permis de le déceler ;
— un vice antérieur à la vente : le défaut doit préexister au transfert des risques.

L'acheteur dispose alors de deux actions : l'action rédhibitoire (annulation de la vente et remboursement intégral) ou l'action estimatoire (réduction du prix). Si le vendeur connaissait le vice, une action en indemnisation peut s'y ajouter. Le délai pour agir est de deux ans à compter de la découverte du vice.","[""Droit du consommateur""]","[""Produits & garanties""]",1,2025-02-12T15:57:33Z,2025-06-25T12:24:52Z,"d05c9ea4-b2fb-43e7-9de4-52fe8577e54b",,"8629384f-2b42-49ae-8139-c9d95e45634e",2026-04-29T09:36:23Z,2026-04-29T09:36:23Z,"d05c9ea4-b2fb-43e7-9de4-52fe8577e54b"
"Comment le cabinet vous accompagne-t-il après un accident de la vie courante ?","Après un accident de la vie courante, le cabinet analyse votre dossier, évalue vos droits à indemnisation et fait contrepoids face à l'assureur, qui tend structurellement à sous-évaluer les préjudices ou à en écarter certains.

Concrètement, le cabinet négocie des contre-offres indemnitaires poste par poste. Si l'expertise médicale mandatée par l'assureur est insuffisante, une expertise contradictoire est sollicitée — souvent via une procédure de référé expertise judiciaire — avec l'appui d'un médecin conseil indépendant.

Lorsque le fait dommageable est susceptible de qualification pénale, le cabinet peut déposer plainte ou se constituer partie civile devant le tribunal correctionnel.

En cas de désaccord persistant sur l'évaluation des préjudices ou sur l'application d'un contrat garantie accidents de la vie (GAV), une action judiciaire est engagée pour faire valoir vos droits.","[""Accidents de la vie courante""]","[""Accompagnement""]",1,2025-03-19T09:29:05Z,2025-06-25T12:24:52Z,"07454f1f-c54a-4308-b897-19be554db88a",,"8737d78f-eb7e-468c-9df0-9e65b9e04ea6",2026-04-29T09:36:23Z,2026-04-29T09:36:23Z,"d05c9ea4-b2fb-43e7-9de4-52fe8577e54b"
"Pourquoi le dirigeant peut-il être poursuivi pour des faits commis au sein de l’entreprise ?","Le dirigeant peut être poursuivi pénalement pour des faits commis au sein de son entreprise parce que la loi le désigne comme garant de l'ordre juridique dans la structure qu'il dirige. En tant que représentant légal, il est présumé avoir autorité pour prévenir les infractions.

Le principe posé par l'article 121-1 du Code pénal — « nul n'est responsable pénalement que de son propre fait » — n'exclut pas sa mise en cause. Il peut être poursuivi pour faute personnelle directe (décision illicite qu'il a prise lui-même), ou pour négligence s'il n'a pas empêché une infraction qu'il avait le pouvoir et l'obligation d'éviter.

Une délégation de pouvoir valable — accordée à un délégataire compétent, disposant des moyens nécessaires et d'une réelle autonomie — peut l'exonérer, à condition que la délégation soit antérieure aux faits et clairement établie.","[""Droit pénal des affaires""]","[""Risques Majeurs""]",1,2025-01-15T09:40:40Z,2025-06-25T12:24:52Z,"d05c9ea4-b2fb-43e7-9de4-52fe8577e54b",,"890f4325-84a1-496e-b6c3-05d29cbb48e8",2026-04-29T09:36:23Z,2026-04-29T09:36:23Z,"d05c9ea4-b2fb-43e7-9de4-52fe8577e54b"
"Comment choisir son avocat pour un divorce ?","Pour un divorce, choisissez un avocat spécialisé en droit de la famille, capable de maîtriser à la fois les aspects juridiques et les enjeux humains du dossier. La compétence technique est indispensable, mais la relation de confiance l'est tout autant : vous devrez lui confier des éléments personnels sensibles.

Vérifiez que l'avocat pratique régulièrement le droit de la famille et connaît les différentes procédures : divorce par consentement mutuel, divorce pour faute, divorce accepté. Chaque situation appelle une stratégie différente, notamment lorsque des enfants, un patrimoine immobilier ou une pension alimentaire sont en jeu.

Lors du premier rendez-vous, évaluez sa disponibilité, sa clarté d'explication et sa capacité à vous présenter des options concrètes. Un bon avocat ne se contente pas de subir la procédure : il anticipe, négocie et défend activement vos intérêts.","[""Droit de la famille""]","[""Divorce et séparation""]",1,2025-02-18T15:16:05Z,2025-09-22T12:42:28Z,"d05c9ea4-b2fb-43e7-9de4-52fe8577e54b",,"8911b2cf-0ee4-4de7-8ff4-60b1c476ae04",2026-04-29T09:36:23Z,2026-04-29T09:36:23Z,"d05c9ea4-b2fb-43e7-9de4-52fe8577e54b"
"Combien de temps dure une procédure devant la Cour de cassation ?","Une procédure devant la Cour de cassation dure en moyenne 12 à 18 mois à compter du dépôt du pourvoi.

Si la Cour rend un arrêt de cassation, elle annule la décision contestée et renvoie l'affaire devant une nouvelle cour d'assises pour être jugée à nouveau.

Si elle rend un arrêt de rejet, elle confirme la décision attaquée, qui devient définitive. Les voies de recours devant les juridictions françaises sont alors épuisées — un recours devant la Cour européenne des droits de l'homme (CEDH) reste toutefois possible sous certaines conditions.","[""Droit Pénal"",""Procès criminel""]","[""Pourvoi en Cassation""]",1,2025-01-28T14:36:38Z,2025-06-25T12:24:52Z,"d05c9ea4-b2fb-43e7-9de4-52fe8577e54b",,"8a176e0c-9a73-45aa-a780-df523987e188",2026-04-29T09:36:23Z,2026-04-29T09:36:23Z,"d05c9ea4-b2fb-43e7-9de4-52fe8577e54b"
"Qu'est-ce qu'un grand blessé dans un accident de la route ?","On parle de grand blessé lorsque la victime subit des atteintes physiques ou neurologiques graves laissant des séquelles durables ou irréversibles : traumatisme crânien sévère, lésion de la moelle épinière (paraplégie, tétraplégie), déficit sensitivo-moteur majeur.

Ces blessures entraînent des besoins lourds et permanents : logement adapté, véhicule aménagé, assistance par une tierce personne, appareillage médical spécialisé. Le taux d'incapacité permanente partielle (IPP) retenu par les médecins experts est souvent supérieur à 30 %, ce qui place ces victimes dans une catégorie d'indemnisation spécifique, distincte des blessés légers ou modérés.","[""Accidents de la route""]","[""Grands blessés""]",1,2025-07-23T19:56:20Z,2025-07-23T19:58:22Z,"d05c9ea4-b2fb-43e7-9de4-52fe8577e54b",,"8a37aac3-2433-4445-8427-988fdb3cc42b",2026-04-29T09:36:23Z,2026-04-29T09:36:23Z,"d05c9ea4-b2fb-43e7-9de4-52fe8577e54b"
"Comment un avocat peut-il mʼaider à constituer un dossier solide après un sinistre ?","Dès la survenance dʼun sinistre, un avocat spécialisé en droit des assurances analyse votre contrat, identifie les garanties mobilisables et vérifie que les clauses dʼexclusion ou de déchéance sont rédigées en caractères très apparents, comme lʼexige lʼarticle L. 112-4 du Code des assurances.

Il vous guide ensuite dans la collecte des preuves — photos, témoignages, constats amiables, factures — et veille à ce que la déclaration de sinistre soit transmise à lʼassureur dans les délais contractuels (généralement 5 jours ouvrés pour un vol, 10 jours après une catastrophe naturelle).

Enfin, il évalue lʼensemble de vos préjudices : dommages corporels, matériels, économiques ou perte dʼexploitation, afin que lʼindemnisation proposée soit conforme à lʼétendue réelle du sinistre.","[""Droit des assurances particuliers et professionnels""]","[""Sinistre et indemnisation""]",1,2025-02-10T14:51:25Z,2025-06-25T12:24:52Z,"d05c9ea4-b2fb-43e7-9de4-52fe8577e54b",,"8b44a4fe-d0d3-48af-8d1f-e55cad696995",2026-04-29T09:36:23Z,2026-04-29T09:36:23Z,"d05c9ea4-b2fb-43e7-9de4-52fe8577e54b"
"Dois-je porter plainte pour être indemnisé après un accident de la route ?","Porter plainte nʼest pas obligatoire pour obtenir une indemnisation après un accident de la route. La loi Badinter du 5 juillet 1985 oblige lʼassureur du responsable à vous indemniser sans que vous ayez à engager de poursuites pénales.

La plainte devient utile dans plusieurs situations : le conducteur responsable conteste sa faute, lʼindemnisation proposée par lʼassureur est manifestement insuffisante, ou les faits présentent une gravité particulière (blessures lourdes, délit de fuite, conduite sous lʼemprise de lʼalcool). Elle permet alors dʼobtenir une reconnaissance pénale de la responsabilité, ce qui renforce votre position dans la négociation indemnitaire.

En cas de blessures graves ou de refus de lʼassureur, un avocat peut vous aider à évaluer lʼopportunité de déposer plainte et à saisir le juge civil ou pénal.","[""Accidents de la route""]","[""Procédure d'indemnisation""]",1,2025-01-16T13:41:05Z,2025-06-25T12:24:52Z,"d05c9ea4-b2fb-43e7-9de4-52fe8577e54b",,"8cae08c6-351e-4ec6-b4c3-5b5fbca6a5b6",2026-04-29T09:36:23Z,2026-04-29T09:36:23Z,"d05c9ea4-b2fb-43e7-9de4-52fe8577e54b"
"Quelles solutions d’hébergement d’urgence peuvent être mises en place si je dois quitter mon domicile à cause des violences ?","Plusieurs solutions existent pour vous mettre à l'abri rapidement. Le 115 (numéro national gratuit, 24h/24) oriente vers un centre d'hébergement d'urgence proposant un toit, un accompagnement social et psychologique. Des places réservées aux victimes de violences conjugales, accessibles via le 3919, offrent un environnement sécurisé pour vous et vos enfants.

En cas de danger grave et immédiat, une hospitalisation — notamment en service de gynécologie-obstétrique — peut assurer votre protection le temps que d'autres solutions soient organisées.

Les centres d'accueil de jour constituent également un premier point d'entrée : écoute, orientation, et services pratiques (boîte aux lettres sécurisée, douche, laverie). L'association France Victimes (116 006) peut vous accompagner dans ces démarches.","[""Violences conjugales et féminicides""]","[""Mise à l'abri""]",1,2025-02-10T09:40:48Z,2025-06-25T12:24:52Z,"d05c9ea4-b2fb-43e7-9de4-52fe8577e54b",,"8eddcd15-789d-4b83-afda-abe8c436cdc6",2026-04-29T09:36:23Z,2026-04-29T09:36:23Z,"d05c9ea4-b2fb-43e7-9de4-52fe8577e54b"
"Quelle est la durée de l'ordonnance de protection et que faire en cas de violation ?","L'ordonnance de protection est valable 6 mois à compter de sa notification à l'auteur des violences (art. 515-12 du Code civil). Elle peut être prolongée si une procédure devant le juge aux affaires familiales est en cours.

En cas de violation — contact interdit, intrusion dans un lieu prohibé, non-respect des mesures d'éloignement —, la victime doit alerter immédiatement la police ou la gendarmerie. Le non-respect de l'ordonnance constitue une infraction pénale punie de 3 ans d'emprisonnement et 45 000 € d'amende (art. 227-4-2 du Code pénal).

Un avocat peut accompagner la victime pour demander une prolongation ou engager des poursuites en cas de violation.","[""Violences conjugales et féminicides""]","[""Ordonnance de protection""]",1,2025-02-10T10:17:30Z,2025-06-25T12:24:52Z,"d05c9ea4-b2fb-43e7-9de4-52fe8577e54b",,"8ee8a4bc-175c-4db7-a25f-efd50b38bd36",2026-04-29T09:36:23Z,2026-04-29T09:36:23Z,"d05c9ea4-b2fb-43e7-9de4-52fe8577e54b"
