"Question","Réponse","Expertise","Sous - expertise","Like","Created Date","Updated Date","Owner","Title","ID","Created Date","Updated Date","Owner"
"Quelles sont les assurances légalement obligatoires pour les particuliers en 2025 ?","En France, quatre assurances sont légalement obligatoires pour les particuliers : l'assurance maladie (affiliation au régime obligatoire de la Sécurité sociale), la responsabilité civile incluse dans la multirisque habitation, l'assurance automobile pour tout véhicule terrestre à moteur, et l'assurance habitation pour les locataires.

L'assurance maladie est universelle : tout résident doit cotiser auprès de l'organisme correspondant à son statut (CNAM pour les salariés, SSI pour les indépendants).

La responsabilité civile couvre les dommages causés à des tiers (articles 1240 à 1244 du Code civil) ; elle est généralement intégrée au contrat multirisque habitation.

L'assurance automobile est imposée par le Code des assurances (article L.211-1) même pour un véhicule non utilisé.

L'assurance habitation est obligatoire pour les locataires uniquement, qui doivent a minima couvrir les risques locatifs. Les propriétaires occupants n'y sont pas légalement contraints, sauf en copropriété.

Le non-respect de ces obligations expose à des amendes, voire à des peines d'emprisonnement pour le défaut d'assurance automobile.","[""Droit des assurances particuliers et professionnels""]","[""Législation""]",1,2025-03-10T08:40:35Z,2025-06-25T12:24:52Z,"d05c9ea4-b2fb-43e7-9de4-52fe8577e54b",,"00160ce5-5c05-4688-969c-456452290e60",2026-04-29T09:36:23Z,2026-04-29T09:36:23Z,"d05c9ea4-b2fb-43e7-9de4-52fe8577e54b"
"Comment contester un crédit affecté en cas de manquement du prêteur ?","Un crédit affecté peut être contesté sur deux fondements : les manquements à la formation du contrat et les défaillances liées à l'exécution du contrat principal financé. Les sanctions peuvent aller jusqu'à la nullité du crédit ou la déchéance du droit aux intérêts.

À la formation, vérifiez que la fiche d'information précontractuelle a été remise, que lʼoffre a été maintenue au moins 15 jours et que le délai de rétractation de 14 jours calendaires a été respecté. Lʼabsence de vérification de solvabilité (fichier FICP) peut également être invoquée.

À lʼexécution, les fonds ne peuvent être débloqués quʼaprès réalisation effective du contrat principal. Un déblocage anticipé ou une inexécution du vendeur entraîne la caducité du crédit. Des manœuvres dolosives du prêteur ouvrent droit à des dommages et intérêts.

Conséquences possibles : nullité du crédit, déchéance des intérêts (seul le capital reste dû), restitution des échéances versées.

Adressez une réclamation écrite au prêteur, puis saisissez le médiateur de la consommation. En lʼabsence de réponse satisfaisante, le tribunal judiciaire est compétent. Conservez offre, contrat, bons de commande et toute correspondance.","[""Droit du consommateur""]","[""Crédits & finances""]",1,2025-02-12T15:57:36Z,2026-04-28T14:21:31Z,"d05c9ea4-b2fb-43e7-9de4-52fe8577e54b",,"0089d332-3f69-4f80-aaf6-b02956301842",2026-04-29T09:36:23Z,2026-04-29T09:36:23Z,"d05c9ea4-b2fb-43e7-9de4-52fe8577e54b"
"Comment obtenir une indemnisation pour un traumatisme crânien ?","Pour obtenir une indemnisation après un traumatisme crânien, la victime doit documenter précisément son préjudice et engager une procédure amiable ou judiciaire contre le responsable ou son assureur. L'indemnisation est encadrée par la loi Badinter du 5 juillet 1985 lorsque l'accident implique un véhicule terrestre à moteur.

Les postes indemnisables incluent les frais médicaux passés et futurs, la perte de revenus, le déficit fonctionnel permanent (DFP), le préjudice moral, les souffrances endurées et les frais d'assistance par tierce personne — souvent considérables en cas de séquelles neurologiques graves.

Une expertise médicale contradictoire, réalisée idéalement avec un médecin-conseil indépendant aux côtés de la victime, est déterminante pour évaluer correctement l'étendue des séquelles. L'assureur dispose d'un délai de 8 mois à compter de l'accident pour présenter une offre d'indemnisation provisionnelle.

Face à la complexité de ces dossiers, un avocat spécialisé permet de contester une offre insuffisante et de saisir le tribunal judiciaire compétent.","[""Accidents de la route""]","[""Traumatisme crânien""]",1,2025-01-16T13:48:13Z,2025-06-25T12:24:52Z,"d05c9ea4-b2fb-43e7-9de4-52fe8577e54b",,"03822557-49b9-4d1c-83a2-93c96dadbd63",2026-04-29T09:36:23Z,2026-04-29T09:36:23Z,"d05c9ea4-b2fb-43e7-9de4-52fe8577e54b"
"Qu'est-ce que la période de Sûreté ?","La période de sûreté est une durée d'incarcération incompressible pendant laquelle le condamné ne peut bénéficier d'aucun aménagement de peine : ni placement à l'extérieur, ni semi-liberté, ni permissions de sortir, ni libération conditionnelle. Elle s'applique aux peines privatives de liberté sans sursis.

Elle peut être légale (automatique) : un texte spécifique la prévoit pour les infractions les plus graves (meurtres aggravés, empoisonnement, extorsions aggravées…). Le juge n'a pas à la prononcer, il peut seulement en modifier la durée.

Elle peut aussi être décidée (spéciale) : en dehors de tout texte spécifique, le juge peut l'ordonner dès lors que la condamnation est d'au moins 5 ans d'emprisonnement ferme (article 132-23 du Code pénal).

Au fil des réformes, des infractions d'une gravité moindre — comme l'administration de substances nuisibles — ont progressivement intégré le champ de la sûreté légale.","[""Droit Pénal"",""Procès criminel""]","[""Période de sûreté""]",1,2025-01-21T11:22:57Z,2025-06-25T12:24:52Z,"d05c9ea4-b2fb-43e7-9de4-52fe8577e54b",,"0399db80-a2f6-4c58-b2e1-55525af6a7e6",2026-04-29T09:36:23Z,2026-04-29T09:36:23Z,"d05c9ea4-b2fb-43e7-9de4-52fe8577e54b"
"Qu'est-ce qu'une ordonnance de protection et qui peut la demander ?","Lʼordonnance de protection est une mesure dʼurgence délivrée par le Juge aux affaires familiales (JAF) pour protéger les victimes de violences conjugales. Elle permet dʼimposer des restrictions à lʼauteur des violences — notamment lʼinterdiction dʼapprocher la victime — sans attendre lʼissue dʼune procédure pénale.

Peut la demander :
— toute personne victime de violences ou de menaces commises par son conjoint, concubin, partenaire de PACS, actuel ou ancien, même sans cohabitation ;
— toute personne majeure menacée de mariage forcé.

La demande est formée par requête auprès du JAF du tribunal judiciaire compétent. Le juge statue dans un délai de six jours à compter de la fixation de lʼaudience (article 515-11 du Code civil).","[""Violences conjugales et féminicides""]","[""Ordonnance de protection""]",1,2025-02-10T10:17:28Z,2025-06-25T12:24:52Z,"d05c9ea4-b2fb-43e7-9de4-52fe8577e54b",,"0605d4ad-c2e0-496d-99ff-1cbedec64a25",2026-04-29T09:36:23Z,2026-04-29T09:36:23Z,"d05c9ea4-b2fb-43e7-9de4-52fe8577e54b"
"Comment se déroule une procédure d'indemnisation avec l'ONIAM ?","La procédure d'indemnisation avec l'ONIAM peut être amiable ou contentieuse. En voie amiable, la victime saisit une CCI (Commission de Conciliation et d'Indemnisation) : l'ONIAM dispose alors de quatre mois suivant la réception de l'avis de la CCI pour formuler une offre d'indemnisation.

Si la victime accepte l'offre, le règlement intervient dans le délai d'un mois. L'ONIAM n'est pas lié par l'avis de la CCI et peut donc proposer une offre différente, voire ne pas en formuler.

En cas de refus de l'offre ou d'absence d'offre, la victime peut saisir le tribunal administratif (pour un accident survenu dans un établissement public) ou le tribunal judiciaire (établissement privé) pour engager une procédure contentieuse.","[""Accidents et erreurs médicales""]","[""ONIAM""]",1,2025-02-08T22:13:08Z,2025-06-25T12:24:52Z,"d05c9ea4-b2fb-43e7-9de4-52fe8577e54b",,"062175a7-c946-462b-9e48-c566e4776d0f",2026-04-29T09:36:23Z,2026-04-29T09:36:23Z,"d05c9ea4-b2fb-43e7-9de4-52fe8577e54b"
"L'établissement de santé est-il toujours responsable en cas d'infection nosocomiale ?","Les établissements de santé sont présumés responsables des infections nosocomiales sans qu'une faute soit nécessaire à prouver. Cette présomption est toutefois réfragable : l'établissement peut s'exonérer en démontrant une cause étrangère, c'est-à-dire un événement imprévisible, irrésistible et extérieur.

L'article L. 1142-1-1 du Code de la santé publique organise ensuite un partage selon la gravité du dommage :

— Si le déficit fonctionnel permanent (DFP) est inférieur ou égal à 25 %, l'assureur de l'établissement indemnise la victime.

— Si le DFP est supérieur à 25 %, l'ONIAM prend en charge l'indemnisation au titre de la solidarité nationale. L'ONIAM peut toutefois se retourner contre l'assureur de l'établissement lorsqu'une faute est à l'origine de l'infection.","[""Accidents et erreurs médicales""]","[""Infection nosocomiale""]",1,2025-02-08T23:10:51Z,2025-06-25T12:24:52Z,"d05c9ea4-b2fb-43e7-9de4-52fe8577e54b",,"07083789-9b9f-4d12-a69f-fc95d56f6321",2026-04-29T09:36:23Z,2026-04-29T09:36:23Z,"d05c9ea4-b2fb-43e7-9de4-52fe8577e54b"
"Quelles mesures de protection peuvent être mises en place en cas de violences conjugales ?","Face aux violences conjugales, plusieurs outils juridiques permettent une protection rapide. Lʼordonnance de protection (art. 515-9 du Code civil) peut être obtenue en quelques jours : elle peut interdire au conjoint violent dʼapprocher la victime ou le domicile. Depuis la loi du 18 juin 2024, une ordonnance provisoire de protection immédiate peut être délivrée par le juge aux affaires familiales dans les 24 heures.

Le non-respect de ces ordonnances constitue un délit puni de 3 ans dʼemprisonnement et 45 000 € dʼamende (art. 227-4-2 du Code pénal).

En parallèle, le dépôt de plainte déclenche une procédure pénale : les violences conjugales sont réprimées par les articles 222-1 et suivants du Code pénal, avec des circonstances aggravantes spécifiques au cadre conjugal. Le 3919 (numéro national gratuit) oriente les victimes vers les structures dʼaccueil adaptées.

Un avocat peut formuler la demande dʼordonnance de protection, accompagner la victime au dépôt de plainte et assurer le suivi de la procédure pénale.","[""Droit de la famille"",""Violences conjugales et féminicides""]","[""Protection et médiation""]",1,2025-02-10T10:42:43Z,2025-09-22T12:40:02Z,"d05c9ea4-b2fb-43e7-9de4-52fe8577e54b",,"080c9221-e935-4744-82db-ed0ebf90c7c1",2026-04-29T09:36:23Z,2026-04-29T09:36:23Z,"d05c9ea4-b2fb-43e7-9de4-52fe8577e54b"
" Qu'est-ce que le Téléphone Grave Danger (TGD) et comment fonctionne-t-il ?","Le Téléphone Grave Danger (TGD) est un téléphone portable fourni par les autorités judiciaires aux victimes de violences conjugales ou de viol en situation de très grand danger. En pressant un bouton dédié, la victime déclenche immédiatement une alerte et permet sa géolocalisation en temps réel, facilitant une intervention rapide des forces de l'ordre.

Le TGD est attribué sur décision du procureur de la République ou du juge aux affaires familiales. Il s'inscrit dans un ensemble de mesures de protection complémentaires, dont l'ordonnance de protection (article 515-9 du Code civil) et le bracelet anti-rapprochement (BAR), instauré par la loi du 28 décembre 2019.

Depuis 2014, le dispositif est déployé progressivement sur tout le territoire. Il bénéficie d'un appui institutionnel renforcé grâce aux pôles spécialisés violences intra-familiales présents dans les 164 tribunaux judiciaires de France.","[""Violences conjugales et féminicides""]","[""Téléphone Grave Danger""]",1,2025-02-10T10:13:55Z,2025-06-25T12:24:52Z,"d05c9ea4-b2fb-43e7-9de4-52fe8577e54b",,"088fed67-9282-4090-b931-c7a3a1317c42",2026-04-29T09:36:23Z,2026-04-29T09:36:23Z,"d05c9ea4-b2fb-43e7-9de4-52fe8577e54b"
"Qu'est-ce que le DFP (Déficit Fonctionnel Permanent) ?","Le Déficit Fonctionnel Permanent (DFP) désigne les séquelles physiques et/ou psychiques définitives conservées par une victime après la consolidation de son état de santé. Il est exprimé en pourcentage — de 1 % à 100 % — et reflète la réduction durable des capacités de la personne dans sa vie quotidienne.

Ce taux est fixé par un médecin expert, souvent lors d'une expertise judiciaire ou amiable. Il conditionne directement le montant de l'indemnisation versée par l'assureur ou l'ONIAM (Office National d'Indemnisation des Accidents Médicaux) en cas d'erreur médicale.

Le barème indicatif utilisé est le Barème médical indicatif publié par le Concours Médical. Un avocat peut contester le taux retenu si l'évaluation sous-estime les séquelles réelles.","[""Accidents et erreurs médicales"",""Accidents de la route"",""Accidents de la vie courante""]","[""DFP""]",6,2025-02-08T22:16:12Z,2025-07-31T13:54:41Z,"d05c9ea4-b2fb-43e7-9de4-52fe8577e54b",,"0962e40a-5e87-412e-8390-d2d16b217e9e",2026-04-29T09:36:23Z,2026-04-29T09:36:23Z,"d05c9ea4-b2fb-43e7-9de4-52fe8577e54b"
"Qu’est-ce que le travail dissimulé et comment s’en prémunir ?","Le travail dissimulé (« travail au noir ») est une infraction définie aux articles L.8221-1 et suivants du Code du travail : elle sanctionne toute non-déclaration d'activité ou d'emploi salarié — absence de DPAE, bulletins de paie falsifiés, faux statut d'indépendant dissimulant un lien de subordination. Les peines encourues atteignent 3 ans d'emprisonnement et 45 000 € d'amende, auxquels s'ajoutent un redressement URSSAF et l'exclusion des aides publiques.

Pour s'en prémunir, plusieurs réflexes s'imposent : respecter scrupuleusement les obligations déclaratives (DPAE, fiches de paie, durée du travail), éviter les qualifications artificielles (indépendants, stagiaires, bénévoles), et auditer régulièrement vos pratiques RH.

Dès réception d'un avis de contrôle URSSAF, l'assistance d'un avocat pénaliste permet d'organiser la défense, d'établir l'absence d'intentionnalité ou d'activer une délégation de pouvoirs valide.","[""Droit pénal des affaires""]","[""URSSAF""]",1,2025-06-25T12:21:24Z,2025-06-25T12:24:52Z,"d05c9ea4-b2fb-43e7-9de4-52fe8577e54b",,"0a3cca76-5985-41d0-bcac-b83581e3a46b",2026-04-29T09:36:23Z,2026-04-29T09:36:23Z,"d05c9ea4-b2fb-43e7-9de4-52fe8577e54b"
"Quelle est la différence entre la préméditation et l'intention ? ","Lʼintention est la volonté consciente de commettre une infraction : elle conditionne la caractérisation des infractions intentionnelles comme le meurtre (art. 221-1 du Code pénal) ou le vol (art. 311-1 du Code pénal). La préméditation, définie à lʼarticle 132-72 du Code pénal, est le dessein formé avant lʼaction de commettre un crime ou un délit déterminé. Elle nʼest pas un élément constitutif de lʼinfraction, mais une circonstance aggravante.

Concrètement, la préméditation aggrave notamment :
— le meurtre (art. 221-3)
— lʼempoisonnement (art. 221-5)
— les tortures et actes de barbarie (art. 222-3, 9°)
— les violences ayant entraîné la mort sans intention de la donner (art. 222-8, 9°)
— les violences ayant entraîné une mutilation ou une infirmité permanente (art. 222-10, 9°)
— les violences ayant entraîné une ITT supérieure à huit jours (art. 222-12, 9°)
— les violences nʼayant pas entraîné une telle incapacité (art. 222-13, 9°).","[""Droit Pénal""]","[""Préméditation""]",1,2025-01-21T11:40:13Z,2025-06-25T12:24:52Z,"d05c9ea4-b2fb-43e7-9de4-52fe8577e54b",,"0aeb937b-494c-4080-b672-f435523111f7",2026-04-29T09:36:23Z,2026-04-29T09:36:23Z,"d05c9ea4-b2fb-43e7-9de4-52fe8577e54b"
"Comment un avocat en droit des assurances vous accompagne-t-il du contrat au procès ?","Un avocat spécialisé en droit des assurances intervient à chaque étape : analyse et négociation du contrat avant sa signature, gestion du sinistre face à l'assureur, puis procédure judiciaire si le litige persiste. Cet accompagnement global protège vos intérêts de la souscription jusqu'à l'indemnisation définitive.

À la phase pré-contractuelle, il examine les clauses sensibles — exclusions, déchéances, nullité pour fausse déclaration — et négocie les garanties adaptées à votre situation.

En cas de sinistre, il assiste à la déclaration, négocie directement avec l'assureur pour obtenir un règlement amiable et conteste toute décision injustifiée : refus de garantie, clause abusive, déchéance non prouvée.

Si la voie amiable échoue, il rédige les actes de procédure et vous défend devant le tribunal compétent, en veillant au respect des délais légaux — notamment le délai de prescription biennal prévu à l'article L. 114-1 du Code des assurances.","[""Droit des assurances particuliers et professionnels""]","[""Stratégie judiciaire""]",1,2025-02-10T14:57:40Z,2025-06-25T12:24:52Z,"d05c9ea4-b2fb-43e7-9de4-52fe8577e54b",,"0bece60e-8e54-4367-8af6-a2b29c5b4f83",2026-04-29T09:36:23Z,2026-04-29T09:36:23Z,"d05c9ea4-b2fb-43e7-9de4-52fe8577e54b"
"Peut-on être condamné pour crime sans preuve matérielle ?","Oui. En matière criminelle, la loi nʼexige pas de preuve matérielle formelle : la Cour dʼassises statue selon son intime conviction, principe posé par lʼarticle 353 du Code de procédure pénale. Une condamnation peut reposer uniquement sur des témoignages, des aveux ou un faisceau dʼindices graves et concordants, sans pièce à conviction physique.

Lʼaccusé bénéficie toutefois de la présomption dʼinnocence (article 9 de la Déclaration des droits de lʼhomme, article préliminaire du CPP) : le doute doit profiter à lʼaccusé. Si les preuves sont fragiles ou contradictoires, cʼest à la défense de mettre en lumière les incohérences du dossier pour créer ce doute raisonnable.

Devant la Cour criminelle départementale, qui juge désormais la majorité des crimes punis de 15 à 20 ans, ce sont des magistrats professionnels qui délibèrent — ce qui renforce lʼexigence de motivation du verdict.","[""Procès criminel""]","[""Crimes""]",1,2025-01-28T14:33:17Z,2025-06-25T12:24:52Z,"d05c9ea4-b2fb-43e7-9de4-52fe8577e54b",,"0c75cc58-166b-470c-82a3-ac5cc907aa63",2026-04-29T09:36:23Z,2026-04-29T09:36:23Z,"d05c9ea4-b2fb-43e7-9de4-52fe8577e54b"
"Comment protéger ses droits lors d'un achat en ligne dans l'Union européenne ?","En cas de litige avec un vendeur établi dans un autre pays de l'UE, plusieurs recours existent sans passer par un tribunal. La plateforme ODR (Online Dispute Resolution) de la Commission européenne permet de traiter le différend en ligne. Le Centre Européen des Consommateurs France (CEC) accompagne gratuitement les consommateurs dans ces démarches.

Avant tout achat, conservez une copie des conditions générales de vente, des échanges et des confirmations de commande. En cas de problème, commencez par contacter le vendeur par écrit, puis envoyez une mise en demeure si nécessaire.

Vos droits clés : droit de rétractation de 14 jours sans justification ; garantie légale de conformité et garantie des vices cachés (réparation, remplacement ou annulation) ; protection des données personnelles avec recours possible auprès de la CNIL.

En dernier recours, le règlement européen sur les petites créances (CE n° 861/2007) permet une procédure judiciaire simplifiée pour les litiges jusqu'à 5 000 €.","[""Droit du consommateur""]","[""Cas particuliers""]",1,2025-02-12T15:59:26Z,2026-04-28T14:24:17Z,"d05c9ea4-b2fb-43e7-9de4-52fe8577e54b",,"0cf409a7-d34b-4f72-9136-8e278a0c4461",2026-04-29T09:36:23Z,2026-04-29T09:36:23Z,"d05c9ea4-b2fb-43e7-9de4-52fe8577e54b"
"Que faire en cas d'accident de la vie courante avec un tiers impliqué ? ","Lorsqu'un tiers est impliqué dans un accident de la vie courante, c'est son assurance responsabilité civile qui prend en charge votre indemnisation. Encore faut-il établir sa responsabilité : l'assureur conteste parfois sa garantie en niant toute faute de son assuré.

La responsabilité du tiers peut être engagée sur plusieurs fondements :

— Pour faute (articles 1240 et 1241 du Code civil) : défaut d'entretien d'un sol glissant, absence de signalisation du danger, défaut de prudence lors d'une activité sportive, animal mal surveillé, produit défectueux…

— Du fait des choses (article 1242, alinéa 1 du Code civil) : le gardien d'une chose qui cause un dommage en est responsable.

— Du fait des animaux (article 1243) ou des bâtiments en ruine (article 1244).

— Du fait du préposé (article 1242, alinéa 5) ou des enfants mineurs (article 1242, alinéa 4).

Identifier le bon régime de responsabilité conditionne la stratégie d'indemnisation : un avocat peut vous aider à réunir les preuves et à contester un refus de garantie.","[""Accidents de la vie courante""]","[""Tiers responsable""]",1,2025-03-19T09:23:43Z,2025-06-25T12:24:52Z,"07454f1f-c54a-4308-b897-19be554db88a",,"0d1a769d-aba0-4a53-97d8-e15469e832d3",2026-04-29T09:36:23Z,2026-04-29T09:36:23Z,"d05c9ea4-b2fb-43e7-9de4-52fe8577e54b"
"Qu'est-ce que l'obligation d'information du médecin envers son patient ?
","L'obligation d'information médicale est le droit de tout patient d'être informé de son état de santé, des investigations et traitements proposés, de leur utilité, de leurs risques fréquents ou graves normalement prévisibles, des alternatives thérapeutiques et des conséquences prévisibles d'un éventuel refus.

Cette obligation est prévue par l'article L. 1111-2 du Code de la santé publique. Elle s'impose à tout professionnel de santé et doit être délivrée en termes accessibles, par un entretien individuel. L'information est présumée non délivrée si le médecin ne peut en rapporter la preuve.

En cas de manquement, le patient peut obtenir réparation du préjudice de perte de chance ou du préjudice moral lié à l'absence de consentement éclairé.","[""Accidents et erreurs médicales""]","[""Obligation d'information""]",1,2025-02-08T22:23:08Z,2025-06-25T12:24:52Z,"d05c9ea4-b2fb-43e7-9de4-52fe8577e54b",,"11059019-2cb7-421c-b0f9-c87bd59fb5b5",2026-04-29T09:36:23Z,2026-04-29T09:36:23Z,"d05c9ea4-b2fb-43e7-9de4-52fe8577e54b"
"Comment un avocat construit-il une stratégie judiciaire en droit des assurances ?","En droit des assurances, la stratégie judiciaire commence par une analyse du contrat, des déclarations de sinistre et des pièces justificatives pour identifier les clauses litigieuses et les manquements de l'assureur. L'avocat évalue ensuite les chances de succès au regard de la jurisprudence et des textes du Code des assurances et du Code civil, avant d'exposer au client les risques et avantages d'une procédure.

Une tentative de résolution amiable est privilégiée en premier lieu. Si la négociation échoue, l'avocat choisit la procédure adaptée : référé en cas d'urgence, action en responsabilité contractuelle, ou recours en garantie selon la nature du litige. Il veille au strict respect des délais de prescription — deux ans en matière d'assurance (article L. 114-1 du Code des assurances) — et constitue le dossier probant (contrats, correspondances, expertises, témoignages) avant de rédiger les actes de procédure.","[""Droit des assurances particuliers et professionnels""]","[""Stratégie judiciaire""]",1,2025-02-10T14:57:40Z,2025-06-25T12:24:52Z,"d05c9ea4-b2fb-43e7-9de4-52fe8577e54b",,"119367de-ad9c-4172-af40-3f15449f34f0",2026-04-29T09:36:23Z,2026-04-29T09:36:23Z,"d05c9ea4-b2fb-43e7-9de4-52fe8577e54b"
"Qui peut bénéficier d'une pension alimentaire et dans quelles situations ?","La pension alimentaire peut être versée à un enfant mineur ou majeur encore à charge, à un ex-époux dans le besoin, ou à un parent âgé. Elle est due dès lors qu'un lien de parenté ou d'alliance existe et que le bénéficiaire ne peut subvenir à ses besoins seul (article 205 et suivants du Code civil).

Pour les enfants, elle est fixée par le juge aux affaires familiales en fonction des ressources de chaque parent et des besoins de l'enfant — un barème indicatif publié par le ministère de la Justice sert de référence. Elle reste due tant que l'enfant n'est pas financièrement autonome, même après sa majorité.

Pour un ex-époux, la pension alimentaire peut être ordonnée durant la procédure de divorce (contribution aux charges du mariage), puis remplacée par une prestation compensatoire une fois le divorce prononcé.

Elle peut être révisée à tout moment en cas de changement de situation : perte d'emploi, remariage, évolution des besoins de l'enfant. La demande de révision se fait auprès du juge aux affaires familiales.","[""Droit de la famille""]","[""Pension alimentaire""]",1,2025-02-18T15:21:11Z,2025-09-22T12:43:49Z,"d05c9ea4-b2fb-43e7-9de4-52fe8577e54b",,"15ae19a1-d500-41b6-9d2d-4d9984f25db5",2026-04-29T09:36:23Z,2026-04-29T09:36:23Z,"d05c9ea4-b2fb-43e7-9de4-52fe8577e54b"
