"Question","Réponse","Expertise","Sous - expertise","Like","Created Date","Updated Date","Owner","Title","ID","Created Date","Updated Date","Owner"
"Quels sont les différents aménagements de peine possibles ?","Les aménagements de peine permettent d'exécuter une condamnation en dehors de la détention classique. Le juge de l'application des peines (JAP) peut prononcer plusieurs dispositifs selon la situation du condamné et la durée de la peine restant à subir.

Le placement sous surveillance électronique (PSE) : un bracelet électronique impose une présence au domicile à des horaires définis, tout en permettant de travailler et de maintenir une vie de famille.

La semi-liberté : le condamné quitte l'établissement pénitentiaire pendant une plage horaire fixée (généralement la journée pour travailler) et y retourne le soir.

Le placement extérieur : participation à des travaux à l'extérieur de la prison, avec ou sans surveillance de l'administration pénitentiaire.

Le fractionnement ou la suspension de peine : en cas de difficultés familiales ou médicales graves, la peine peut être exécutée par fractions ou temporairement suspendue.

La conversion en jours-amende (peines ≤ 6 mois) : le condamné verse une somme quotidienne fixée selon ses ressources plutôt que d'être incarcéré. Le non-paiement entraîne l'incarcération.

La conversion en travail d'intérêt général (TIG) (peines ≤ 6 mois) : travail non rémunéré effectué pour une collectivité publique ou une association, sous peine de retour en détention.","[""Droit Pénal""]","[""Aménagement de peine""]",1,2025-01-21T11:51:24Z,2025-06-25T12:24:52Z,"d05c9ea4-b2fb-43e7-9de4-52fe8577e54b",,"a9c3a49b-248f-4a4f-8fc5-04d7f245a5e9",2026-04-29T09:36:23Z,2026-04-29T09:36:23Z,"d05c9ea4-b2fb-43e7-9de4-52fe8577e54b"
"Quels régimes d'indemnisation s'appliquent après un accident sportif ?","L'indemnisation d'un accident sportif dépend des circonstances : fait de jeu, violation des règles, faute volontaire ou manquement à l'obligation de sécurité. Chaque situation ouvre un régime distinct.

Fait de jeu : la victime peut être indemnisée par l'assurance du groupement sportif ou par sa propre assurance individuelle, souvent à garanties partielles.

Violation des règles : la responsabilité du joueur fautif ou du club peut être engagée civilement, voire pénalement si la faute est grave et volontaire.

Manquement à l'obligation de sécurité : l'organisateur de l'activité est tenu d'une obligation de sécurité de résultat ou de moyens renforcée selon les sports ; son assurance peut être actionnée.

Accident en autonomie : le sportif blessé seul peut recourir à la garantie accidents de la vie (GAV) de son assureur.

Fait d'une chose : si l'accident implique un objet (balle, équipement), la responsabilité du gardien de la chose peut être engagée sur le fondement de l'article 1242 du Code civil.","[""Accidents de la vie courante""]","[""Accident sportif""]",1,2025-02-10T16:38:51Z,2025-09-28T15:06:28Z,"d05c9ea4-b2fb-43e7-9de4-52fe8577e54b",,"aa3538c9-ef9c-4c05-b997-d08908cac1f0",2026-04-29T09:36:23Z,2026-04-29T09:36:23Z,"d05c9ea4-b2fb-43e7-9de4-52fe8577e54b"
"Quels types de services concrets le CIDFF propose-t-il aux victimes de violences conjugales ?","Les CIDFF (Centres dʼInformation sur les Droits des Femmes et des Familles) proposent aux victimes de violences conjugales une aide gratuite et confidentielle couvrant plusieurs domaines : information juridique sur le dépôt de plainte, lʼordonnance de protection ou le divorce, accompagnement dans les démarches administratives et judiciaires, orientation vers des avocats, psychologues ou assistantes sociales.

Certains CIDFF offrent également un soutien psychologique individuel pour aider à surmonter le traumatisme, ainsi que des groupes de parole permettant de rompre lʼisolement. En cas de danger immédiat, ils orientent aussi vers des structures dʼhébergement dʼurgence.

Pour trouver le CIDFF le plus proche, consultez le site fncidff.info ou appelez le 3919 (numéro national violences femmes).","[""Violences conjugales et féminicides""]","[""CIDFF""]",1,2025-02-10T09:57:47Z,2025-06-25T12:24:52Z,"d05c9ea4-b2fb-43e7-9de4-52fe8577e54b",,"ac2b6910-9ed2-46b4-9bcf-caf5f03579ff",2026-04-29T09:36:23Z,2026-04-29T09:36:23Z,"d05c9ea4-b2fb-43e7-9de4-52fe8577e54b"
"Comment faire rectifier ou supprimer des données personnelles erronées ?","Le RGPD et la loi « Informatique et Libertés » vous donnent le droit d'exiger la correction ou la suppression de vos données personnelles. Adressez d'abord une demande écrite (courrier recommandé ou e-mail) au responsable du traitement concerné, en précisant les données visées et le motif (inexactitude, collecte illégale, données obsolètes). Il dispose d'un mois pour répondre, délai extensible à trois mois pour les demandes complexes.

Vous pouvez invoquer plusieurs droits selon la situation : droit de rectification (article 16 RGPD), droit à l'effacement (article 17 RGPD), ou droit à la limitation du traitement (article 18 RGPD). Conservez toutes les preuves de vos échanges.

En cas de refus ou d'absence de réponse dans les délais, déposez une plainte auprès de la CNIL (cnil.fr) ou saisissez le tribunal judiciaire compétent. Le responsable qui ne donne pas suite s'expose à des sanctions administratives pouvant atteindre 20 millions d'euros ou 4 % du chiffre d'affaires mondial.","[""Droit du consommateur""]","[""Données personnelles""]",1,2025-02-12T15:59:23Z,2025-06-25T12:24:52Z,"d05c9ea4-b2fb-43e7-9de4-52fe8577e54b",,"ac675374-4e70-477d-916a-ac83307d0665",2026-04-29T09:36:23Z,2026-04-29T09:36:23Z,"d05c9ea4-b2fb-43e7-9de4-52fe8577e54b"
"Quelle différence entre diffamation et injure envers un élu ?","La diffamation impute un fait précis portant atteinte à l'honneur (« il a détourné de l'argent ») ; l'injure est une expression outrageante sans imputation de fait (« incapable », insultes). Toutes deux, commises publiquement contre un élu, relèvent d'un régime aggravé de la loi de 1881. La qualification exacte conditionne la stratégie et les moyens de défense.","[""Défense des élus""]","[""Presse & diffamation""]",,,,,,"ad448f44-9af9-4ea3-a544-b4d659b53c47",2026-07-06T13:32:02Z,2026-07-06T13:39:12Z,"d05c9ea4-b2fb-43e7-9de4-52fe8577e54b"
"Qu'est-ce qu'une infection nosocomiale ?","Une infection nosocomiale est une infection contractée dans un établissement de santé — hôpital, clinique ou cabinet libéral — qui n'était ni présente ni en incubation au moment de l'admission du patient. Elle est reconnue comme telle quel que soit le soin pratiqué.

Par convention, un délai de 48 heures après l'admission est généralement retenu pour distinguer une infection nosocomiale d'une infection communautaire préexistante. Pour les infections du site opératoire, ce délai est porté à 30 jours, voire 1 an en cas de pose de prothèse.

Depuis la loi du 4 mars 2002 (dite loi Kouchner) et la loi du 30 décembre 2002, les établissements de santé sont présumés responsables des infections nosocomiales causées à leurs patients, sauf preuve d'une cause étrangère. La victime peut obtenir réparation via l'ONIAM (Office national d'indemnisation des accidents médicaux) lorsque le dommage atteint un certain seuil de gravité.","[""Accidents et erreurs médicales""]","[""Infection nosocomiale""]",1,2025-02-08T23:10:51Z,2025-06-25T12:24:52Z,"d05c9ea4-b2fb-43e7-9de4-52fe8577e54b",,"b09549da-5ec8-4f10-a541-2a90eb334fa3",2026-04-29T09:36:23Z,2026-04-29T09:36:23Z,"d05c9ea4-b2fb-43e7-9de4-52fe8577e54b"
"Que se passe-t-il si le médecin ne respecte pas son obligation d'information ?","Si un médecin manque à son obligation d'information, il engage sa responsabilité civile et vous pouvez obtenir réparation. Deux préjudices sont indemnisables : la perte de chance d'avoir refusé l'acte ou choisi une alternative, et le préjudice d'impréparation, reconnu par la Cour de cassation depuis 2010, qui couvre le bouleversement psychologique causé par la survenance d'un risque que vous ignoriez.

La preuve du défaut d'information incombe au médecin (article L. 1111-2 du Code de la santé publique). La réclamation peut être portée devant la commission de conciliation et d'indemnisation (CCI) ou directement devant les tribunaux. Un avocat spécialisé peut vous aider à chiffrer et défendre ces deux chefs de préjudice.","[""Accidents et erreurs médicales""]","[""Obligation d'information""]",1,2025-02-08T23:00:18Z,2025-06-25T12:24:52Z,"d05c9ea4-b2fb-43e7-9de4-52fe8577e54b",,"b24d630c-a9a3-4df6-a766-47752c068936",2026-04-29T09:36:23Z,2026-04-29T09:36:23Z,"d05c9ea4-b2fb-43e7-9de4-52fe8577e54b"
"Comment quitter mon domicile conjugal en toute sécurité ?","Quitter le domicile conjugal en sécurité nécessite une préparation discrète et organisée. Plusieurs étapes concrètes peuvent réduire le risque au moment du départ.

Préparer un sac d'urgence : quelques vêtements, de l'argent liquide, vos médicaments et vos documents essentiels (pièce d'identité, livret de famille, relevés bancaires, certificats médicaux). Conservez-le dans un endroit accessible à vous seul.

Identifier des personnes et lieux sûrs : prévenez à l'avance un proche de confiance ou contactez une association spécialisée (France Victimes — 116 006, ou le 3919 pour les femmes victimes de violences) pour organiser votre accueil.

Sur le plan juridique : si une ordonnance de protection a été rendue, signalez votre départ à votre bailleur par lettre recommandée avec ce justificatif pour mettre fin à la solidarité locative. En l'absence d'ordonnance, un avocat peut vous aider à sécuriser cette démarche et à anticiper les suites (hébergement d'urgence, garde des enfants, pension alimentaire).

Un travailleur social ou une association d'aide aux victimes peut vous aider à construire un plan de sécurité personnalisé avant le départ.","[""Violences conjugales et féminicides""]","[""Mise à l'abri""]",1,2025-02-10T09:40:49Z,2025-06-25T12:24:52Z,"d05c9ea4-b2fb-43e7-9de4-52fe8577e54b",,"b359bf41-5156-4f28-81f1-083031f20f72",2026-04-29T09:36:23Z,2026-04-29T09:36:23Z,"d05c9ea4-b2fb-43e7-9de4-52fe8577e54b"
"Qu'est-ce qu'un Centre de prise en charge des auteurs de violences conjugales ?","Un Centre de prise en charge des auteurs de violences conjugales (CPCA) est une structure qui propose aux auteurs de violences un suivi psychothérapeutique, médical et socioprofessionnel, dans le but de prévenir la récidive.

Ces centres interviennent souvent dans le cadre d'une mesure judiciaire — obligation de soin, stage de responsabilisation, contrôle judiciaire ou suivi post-condamnatoire. Pour la victime, le fait que son agresseur soit suivi dans un CPCA peut constituer un élément concret pris en compte par le juge pour évaluer le niveau de danger.","[""Violences conjugales et féminicides""]","[""Ma situation""]",1,2025-02-10T09:35:27Z,2025-06-25T12:24:52Z,"d05c9ea4-b2fb-43e7-9de4-52fe8577e54b",,"b3860a1f-8424-41d4-919f-ce8574422ebf",2026-04-29T09:36:23Z,2026-04-29T09:36:23Z,"d05c9ea4-b2fb-43e7-9de4-52fe8577e54b"
"Qu'est-ce que la mise à l'abri en cas de violences conjugales ?","La mise à l'abri désigne l'ensemble des mesures permettant de vous soustraire immédiatement à un conjoint ou partenaire violent : quitter le domicile, rejoindre un hébergement sécurisé et rompre tout contact avec l'auteur des violences.

Elle est cruciale parce que les violences conjugales — physiques, psychologiques, sexuelles ou économiques — s'intensifient souvent au moment où la victime cherche à partir. La loi prévoit plusieurs dispositifs concrets : ordonnance de protection (art. 515-9 du Code civil), éviction du conjoint violent du domicile, hébergement d'urgence via le 115, et bracelet anti-rapprochement en cas de danger grave.

Ces protections peuvent être obtenues en urgence. Un avocat peut vous accompagner pour les activer rapidement.","[""Violences conjugales et féminicides""]","[""Mise à l'abri""]",1,2025-02-10T09:40:47Z,2025-06-25T12:24:52Z,"d05c9ea4-b2fb-43e7-9de4-52fe8577e54b",,"b43ead2b-1504-41f0-b606-1600bcb6d103",2026-04-29T09:36:23Z,2026-04-29T09:36:23Z,"d05c9ea4-b2fb-43e7-9de4-52fe8577e54b"
"Comment sont indemnisées les victimes dʼun accident du travail ?","Le Code de la sécurité sociale prévoit un régime forfaitaire dʼindemnisation des accidents du travail, distinct du droit commun. La victime bénéficie dʼindemnités journalières majorées, dʼune prise en charge intégrale des frais médicaux, et dʼune rente viagère ou dʼun capital selon le taux dʼincapacité permanente retenu.

Incapacité permanente ≥ 10 % : une rente mensuelle ou trimestrielle à vie est versée. En dessous de ce seuil, lʼindemnisation prend la forme dʼun capital unique.

Faute inexcusable de lʼemployeur : si lʼaccident résulte dʼune faute inexcusable (art. L. 452-1 CSS), la victime peut obtenir une majoration de rente et la réparation de préjudices complémentaires — douleurs, préjudice esthétique, préjudice dʼagrément — normalement exclus du régime forfaitaire.

Un avocat peut vous accompagner pour engager cette action devant le pôle social du tribunal judiciaire.","[""Droit et accidents du travail""]","[""Procédure d'indemnisation"",""Accident du travail""]",1,2025-02-19T14:27:01Z,2025-06-25T12:24:52Z,"d05c9ea4-b2fb-43e7-9de4-52fe8577e54b",,"b4f837fc-af09-447e-ba97-d3ec959ab8c1",2026-04-29T09:36:23Z,2026-04-29T09:36:23Z,"d05c9ea4-b2fb-43e7-9de4-52fe8577e54b"
"Quels sont les risques en cas de prêt de main-d’œuvre illicite ?","Le prêt de main-dʼœuvre illicite, défini à lʼarticle L.8241-1 du Code du travail, consiste à mettre du personnel à disposition dʼune entreprise à but lucratif, sans objet réel dʼactivité. Lorsquʼil cause un préjudice au salarié, il constitue un marchandage, sanctionné plus sévèrement.

Sur le plan pénal, les peines atteignent 2 ans dʼemprisonnement et 30 000 € dʼamende pour une personne physique, 150 000 € dʼamende pour une personne morale. En cas de bande organisée ou de vulnérabilité du salarié, la peine peut monter à 10 ans dʼemprisonnement. Des peines complémentaires sʼajoutent : fermeture dʼétablissement, exclusion des marchés publics, confiscations.

Sur le plan administratif, lʼentreprise sʼexpose à un redressement URSSAF, au remboursement des aides publiques perçues et à une responsabilité solidaire avec ses sous-traitants. Un accident du travail non couvert peut également engager la responsabilité civile de lʼentreprise utilisatrice.","[""Droit pénal des affaires""]","[""URSSAF""]",1,2025-06-25T12:23:46Z,2025-06-25T12:24:52Z,"d05c9ea4-b2fb-43e7-9de4-52fe8577e54b",,"b5e65d20-d710-48a8-bf80-0b132be5a150",2026-04-29T09:36:23Z,2026-04-29T09:36:23Z,"d05c9ea4-b2fb-43e7-9de4-52fe8577e54b"
"Que faire si mon assureur refuse de m'indemniser après un sinistre ?","Face à un refus d'indemnisation, commencez par demander à votre assureur les motifs écrits du refus : il est tenu de les justifier. Vérifiez ensuite si ce refus repose sur une clause d'exclusion, de déchéance ou sur une prétendue fausse déclaration — ces clauses sont strictement encadrées et peuvent être contestées.

Plusieurs voies s'offrent à vous. Vous pouvez d'abord saisir le médiateur de l'assurance, dont les coordonnées doivent figurer dans votre contrat (obligation légale issue du Code des assurances). Cette démarche est gratuite et suspend les délais de prescription, fixés à deux ans en matière d'assurance (article L. 114-1 du Code des assurances).

Si la médiation échoue, une action judiciaire reste possible : assignation en exécution forcée du contrat ou en responsabilité contractuelle. En cas d'urgence, un référé peut être envisagé pour obtenir une provision sur indemnisation.

Un avocat en droit des assurances peut analyser votre contrat, identifier les clauses contestables et défendre vos intérêts en négociation ou devant le tribunal.","[""Droit des assurances particuliers et professionnels""]","[""Sinistre et indemnisation""]",1,2025-02-10T14:51:29Z,2025-06-25T12:24:52Z,"d05c9ea4-b2fb-43e7-9de4-52fe8577e54b",,"b6a078c6-b9f0-48c9-a0f0-d4670d7ac8a6",2026-04-29T09:36:23Z,2026-04-29T09:36:23Z,"d05c9ea4-b2fb-43e7-9de4-52fe8577e54b"
"Quelle est la durée maximale d'une garde à vue ?","La durée initiale d'une garde à vue est de 24 heures, prolongeable à 48 heures sur autorisation écrite et motivée du Procureur de la République, dès lors que la peine encourue est supérieure à un an d'emprisonnement.

Pour les affaires de délinquance ou de criminalité organisée, des prolongations supplémentaires portent la durée maximale à 96 heures, sous le contrôle du juge des libertés et de la détention (JLD).

En matière terroriste, la garde à vue peut atteindre 144 heures (6 jours), sur autorisation du JLD et dans des conditions strictement encadrées par les articles 63 et suivants du Code de procédure pénale.","[""Droit Pénal""]","[""Garde à vue""]",1,2025-01-21T11:16:56Z,2025-06-25T12:24:52Z,"d05c9ea4-b2fb-43e7-9de4-52fe8577e54b",,"b9dfb679-d915-457f-89e5-69930ca16cdc",2026-04-29T09:36:23Z,2026-04-29T09:36:23Z,"d05c9ea4-b2fb-43e7-9de4-52fe8577e54b"
"Quelles sont les obligations du condamné en détention à domicile sous surveillance électronique ?","Le condamné en détention à domicile sous surveillance électronique (DDSE) doit respecter les horaires de présence à domicile fixés par le juge de l'application des peines (JAP), porter le bracelet électronique en permanence et ne pas tenter de le détériorer ou de le retirer. Il doit également se soumettre aux contrôles du service pénitentiaire d'insertion et de probation (SPIP).

En cas de manquement, le JAP peut prononcer un avertissement, modifier les horaires de présence ou révoquer la DDSE et ordonner l'incarcération.","[""Droit Pénal""]","[""Détention à domicile""]",1,2025-01-21T11:59:02Z,2025-06-25T12:24:52Z,"d05c9ea4-b2fb-43e7-9de4-52fe8577e54b",,"bb8b95b0-b5a8-4b99-8f44-2ebafa339170",2026-04-29T09:36:23Z,2026-04-29T09:36:23Z,"d05c9ea4-b2fb-43e7-9de4-52fe8577e54b"
"Quelle différence entre l'aléa thérapeutique et  une faute médicale ?","La faute médicale résulte d'un manquement aux règles de l'art ou aux données acquises de la science : elle engage la responsabilité du médecin ou de l'établissement de santé. L'aléa thérapeutique, au contraire, est une complication anormale et imprévisible survenue sans aucune faute.

Dans ce second cas, aucune responsabilité n'est engagée, mais la victime peut être indemnisée par la solidarité nationale, via l'ONIAM (Office national d'indemnisation des accidents médicaux), à condition que le dommage soit suffisamment grave (atteinte au taux d'incapacité permanente partielle supérieure à 24 % ou critères équivalents fixés par l'article L. 1142-1 II du Code de la santé publique).","[""Accidents et erreurs médicales""]","[""Aléa thérapeutique""]",1,2025-02-08T23:10:51Z,2025-06-25T12:24:52Z,"d05c9ea4-b2fb-43e7-9de4-52fe8577e54b",,"bbe37e93-f2f1-4d8f-8c13-22c9e6ab3182",2026-04-29T09:36:23Z,2026-04-29T09:36:23Z,"d05c9ea4-b2fb-43e7-9de4-52fe8577e54b"
"Quelles sont les infractions les plus répandues en droit pénal des affaires ?","En droit pénal des affaires, les infractions les plus fréquentes sont l'abus de biens sociaux (art. L. 241-3 et L. 242-6 du Code de commerce), l'abus de confiance (art. 314-1 du Code pénal), l'escroquerie (art. 313-1), la corruption et le trafic d'influence (art. 432-11 et suivants), ainsi que la fraude fiscale (art. 1741 du CGI) et le blanchiment (art. 324-1).

S'y ajoutent la banqueroute (art. L. 654-2 du Code de commerce), le faux et usage de faux (art. 441-1 du Code pénal) et les pratiques commerciales trompeuses (art. L. 121-2 du Code de la consommation).

Ces infractions exposent leurs auteurs à des peines pouvant aller jusqu'à 10 ans d'emprisonnement et des amendes très lourdes, sans compter les sanctions complémentaires comme l'interdiction de gérer.","[""Droit pénal des affaires""]","[""Risques Majeurs""]",2,2025-01-15T09:40:41Z,2025-06-25T12:24:52Z,"d05c9ea4-b2fb-43e7-9de4-52fe8577e54b",,"bcda80a7-5b10-4395-98f3-535c456ff125",2026-04-29T09:36:23Z,2026-04-29T09:36:23Z,"d05c9ea4-b2fb-43e7-9de4-52fe8577e54b"
"Comment activer la garantie légale de conformité ?","La garantie légale de conformité (art. L217-4 et suivants du Code de la consommation) vous permet d'obtenir la réparation, le remplacement ou le remboursement d'un bien défectueux sans avoir à prouver l'existence du défaut au moment de l'achat.

Vous disposez de deux ans à compter de la conclusion du contrat pour agir (un an pour un bien d'occasion). Tout défaut apparu dans ce délai est présumé exister dès la vente.

Pour activer la garantie, contactez le vendeur par écrit en décrivant le défaut et en demandant la mise en conformité. Il doit procéder à la réparation ou au remplacement sans frais. Si ces solutions sont impossibles, vous pouvez obtenir une réduction du prix ou la résolution du contrat (remboursement).

En cas de refus du vendeur, saisissez le médiateur de la consommation compétent, obligatoirement désigné par le professionnel. Si la médiation échoue, le litige peut être porté devant le tribunal judiciaire du lieu de livraison ou du domicile du vendeur.","[""Droit du consommateur""]","[""Produits & garanties""]",1,2025-02-12T15:57:33Z,2025-06-25T12:24:52Z,"d05c9ea4-b2fb-43e7-9de4-52fe8577e54b",,"bdc9cea0-05a9-424a-b2db-cc03741912e6",2026-04-29T09:36:23Z,2026-04-29T09:36:23Z,"d05c9ea4-b2fb-43e7-9de4-52fe8577e54b"
"Comment un avocat peut-il mʼaider à optimiser ma couverture dʼassurance ?","Un avocat spécialisé en droit des assurances analyse votre situation personnelle et professionnelle pour identifier les risques réels auxquels vous êtes exposé — responsabilité civile, patrimoine immobilier et mobilier, activité artisanale ou commerciale — et vérifier que vos contrats y répondent effectivement.

Il examine clause par clause vos polices existantes : lacunes de garantie, exclusions mal rédigées, déchéances cachées, non-conformité aux exigences légales (notamment issues du Code des assurances). Il vous conseille ensuite sur les ajustements concrets : revalorisation des plafonds, ajout de garanties complémentaires, suppression des doublons.

Il vous alerte aussi sur les délais impératifs : délai de déclaration de sinistre (souvent 5 jours ouvrés pour un vol, 2 jours pour un accident du travail), délai de prescription biennale (article L. 114-1 du Code des assurances), et délai de dénonciation avant tacite reconduction.","[""Droit des assurances particuliers et professionnels""]","[""Gestion des risques""]",1,2025-02-10T14:55:59Z,2025-06-25T12:24:52Z,"d05c9ea4-b2fb-43e7-9de4-52fe8577e54b",,"bdf83a83-2c8a-4df1-b145-ce9584917415",2026-04-29T09:36:23Z,2026-04-29T09:36:23Z,"d05c9ea4-b2fb-43e7-9de4-52fe8577e54b"
"Comment défendre une personne accusée de meurtre avec préméditation ?","Défendre un accusé de meurtre avec préméditation — qualifié d'assassinat par l'article 221-3 du Code pénal, passible de la réclusion criminelle à perpétuité — repose sur plusieurs axes stratégiques selon les éléments du dossier.

La première ligne de défense consiste à contester la préméditation : l'accusation doit prouver que l'acte a été résolu avant sa commission. L'absence de planification établie (absence de repérages, de préparation matérielle, de communications incriminantes) peut permettre une requalification en meurtre simple (article 221-1), dont la peine maximale est de 30 ans.

Autre axe majeur : invoquer un trouble mental au sens de l'article 122-1 du Code pénal, qui peut aboutir à une irresponsabilité pénale ou à une atténuation de la peine selon le degré du trouble.

Enfin, la défense peut cibler la solidité des preuves : contester la légalité des actes d'enquête, la valeur des expertises médico-légales ou la crédibilité des témoignages.

Dans une procédure criminelle, l'assistance d'un avocat pénaliste est indispensable dès la garde à vue.","[""Procès criminel""]","[""Crimes""]",1,2025-01-28T14:33:16Z,2025-06-25T12:24:52Z,"d05c9ea4-b2fb-43e7-9de4-52fe8577e54b",,"be2f8daa-c96e-4d84-af7f-63fccaaaafd1",2026-04-29T09:36:23Z,2026-04-29T09:36:23Z,"d05c9ea4-b2fb-43e7-9de4-52fe8577e54b"
"Quand un accident est-il présumé être un accident du travail ?","Tout accident survenu sur le lieu et pendant le temps de travail est présumé être un accident du travail (article L. 411-1 du Code de la sécurité sociale). Cette présomption est automatique : le salarié nʼa pas à prouver le lien avec son activité professionnelle.

Cʼest à lʼemployeur ou à la caisse primaire dʼassurance maladie (CPAM) dʼapporter la preuve que lʼaccident est étranger au travail pour renverser cette présomption. À défaut, la prise en charge au titre de la législation professionnelle sʼapplique de plein droit.","[""Droit et accidents du travail""]","[""Accident du travail""]",1,2025-02-19T14:26:27Z,2025-06-25T12:24:52Z,"d05c9ea4-b2fb-43e7-9de4-52fe8577e54b",,"be4c7b1b-a207-4e02-a216-ab54fabdb439",2026-04-29T09:36:23Z,2026-04-29T09:36:23Z,"d05c9ea4-b2fb-43e7-9de4-52fe8577e54b"
